step_name,text,img,text_key_1,type_key_1,text_key_2,type_key_2,text_key_3,type_key_3,text_key_4,type_key_4
third_day_1,"СОВЕТ #3. ПОЙМИ, КАК РАБОТАЮТ ПРИВЫЧКИ

Чтобы научиться формировать привычки, надо разобраться как они работают.

По словам Чарльза Дахигга, автора книги «Сила привычки», каждая привычка состоит из трех компонентов:

1. Сигнал, который является триггером для начала поведения (например, сработал будильник)
2. Действие. Это и есть желательное поведение (например, встать с постели)
3. Награда, которая заставляет мозг поощрять такие действия в будущем (как ароматная чашка кофе, которая ожидает тебя, когда ты встаешь с постели)

В течение десятилетий люди сосредоточивались исключительно на самой привычке. И когда не получалось, винили свою слабохарактерность.

Шоколад может помочь тебе больше тренироваться и похудеть. Противоречиво, но это работает. Награды стимулируют правильное поведение, поэтому выбор награды —  самый важный шаг.",,👍🏼 Интересно,,👎🏻 Не интересно,,,,,
third_day_2,"👉 СДЕЛАЙ ПРЯМО СЕЙЧАС:
Выбери триггер. Самое простое — привязать занятия к уже существующим регулярным действиям. Например позаниматься 5 минут сразу после завтрака. Ещё один хороший вариант — установить напоминания на каждый день.
Выбери рутину — ежедневное действие
Выбери награду. Помни, что это самое важное!
Вдохновляйся идеями других участников и напиши, что у тебя получилось в группе https://vk.com/topic-83727735_40908382",,👍🏼 Готово,,🤓 Сложно,,,,,
third_day_3,"✅Done: Ежедневное задание марафона, по формированию привычки

А теперь время попрактиковать английский. Привычка и нейронные связи сами себя не сформируют 😉",,👍🏼Сделал,,👎🏻Не хочу делать,,,,,
third_day_4,"✅Done: Ежедневное занятие английским

Поздравляю, ты в ударе! Сегодня ты выполнил 100% ежедневного плана.

🎁Лови от меня очередной подарок 👇🏻

⚒ ИНСТРУМЕНТ ДНЯ. Ещё одно полезное расширение для браузера Grammarly — https://vk.cc/aqRXSg, оно помогает на лету находить орфографические ошибки и пунктуацию, когда ты пишешь текст.

😉 До встречи завтра на новом дне марафона",,,,,,,,,